<?xml version="1.0" encoding="UTF-8"?>
<book xmlns:xsi="http://www.w3.org/2001/XMLSchema-instance" xsi:noNamespaceSchemaLocation="file:///C:/NIT/Webservices/book-type1.xsd">
	<title>XML &amp; Webservices</title>
	<id>101</id>
	<author>
		<dob>1991-05-20</dob>
		<authorName>Ashok Bollepalli</authorName>
	</author>
	<publisher>
		<publisherName>Midhuna Xerox Centre</publisherName>
		<established-year>2010</established-year>
	</publisher>
</book>
